<?xml version="1.0" encoding="UTF-8"?>
<dictionaries xmlns:xsi="http://www.w3.org/2001/XMLSchema-instance"
              xsi:noNamespaceSchemaLocation="dictionaries.xsd">
    <dictionary>
        <id>dict-type-dict-value-type</id>
        <code>DICT_VALUE_TYPE</code>
        <name>字典值类型</name>
        <description>数据字典值类型。</description>
        <enumClass>com.corwin.system.dict.domain.model.DictValueType</enumClass>
        <valueType>STRING</valueType>
        <structureType>FLAT</structureType>
        <enabled>true</enabled>
    </dictionary>
    <dictionary>
        <id>dict-type-dict-structure-type</id>
        <code>DICT_STRUCTURE_TYPE</code>
        <name>字典结构类型</name>
        <description>数据字典结构类型。</description>
        <enumClass>com.corwin.system.dict.domain.model.DictStructureType</enumClass>
        <valueType>STRING</valueType>
        <structureType>FLAT</structureType>
        <enabled>true</enabled>
    </dictionary>
    <dictionary>
        <id>dict-type-dict-source-type</id>
        <code>DICT_SOURCE_TYPE</code>
        <name>字典来源类型</name>
        <description>数据字典来源类型。</description>
        <enumClass>com.corwin.system.dict.domain.model.DictSourceType</enumClass>
        <valueType>STRING</valueType>
        <structureType>FLAT</structureType>
        <enabled>true</enabled>
    </dictionary>
    <dictionary>
        <id>dict-type-dict-item-tag-type</id>
        <code>DICT_ITEM_TAG_TYPE</code>
        <name>字典项标签类型</name>
        <description>字典项标签类型。</description>
        <enumClass>com.corwin.framework.dict.DictTagType</enumClass>
        <valueType>STRING</valueType>
        <structureType>FLAT</structureType>
        <enabled>true</enabled>
    </dictionary>
    <dictionary>
        <id>dict-type-dict-item-tag-color</id>
        <code>DICT_ITEM_TAG_COLOR</code>
        <name>字典项标签颜色</name>
        <description>字典项标签颜色。</description>
        <enumClass>com.corwin.framework.dict.DictTagColor</enumClass>
        <valueType>STRING</valueType>
        <structureType>FLAT</structureType>
        <enabled>true</enabled>
    </dictionary>
    <dictionary>
        <id>dict-type-msg-type</id>
        <code>MSG_TYPE</code>
        <name>消息类型</name>
        <description>通知消息类型。</description>
        <enumClass>com.corwin.system.notify.published.MsgType</enumClass>
        <valueType>STRING</valueType>
        <structureType>FLAT</structureType>
        <enabled>true</enabled>
    </dictionary>
    <dictionary>
        <id>dict-type-msg-priority</id>
        <code>MSG_PRIORITY</code>
        <name>消息优先级</name>
        <description>通知消息优先级。</description>
        <enumClass>com.corwin.system.notify.domain.model.MsgPriority</enumClass>
        <valueType>STRING</valueType>
        <structureType>FLAT</structureType>
        <enabled>true</enabled>
    </dictionary>
    <dictionary>
        <id>dict-type-todo-task-status</id>
        <code>TODO_TASK_STATUS</code>
        <name>待办状态</name>
        <description>待办任务状态。</description>
        <enumClass>com.corwin.reminder.domain.model.TodoTaskStatus</enumClass>
        <valueType>STRING</valueType>
        <structureType>FLAT</structureType>
        <enabled>true</enabled>
    </dictionary>
    <dictionary>
        <id>dict-type-user-status</id>
        <code>USER_STATUS</code>
        <name>用户状态</name>
        <description>用户状态。</description>
        <enumClass>com.corwin.system.user.domain.model.UserStatus</enumClass>
        <valueType>STRING</valueType>
        <structureType>FLAT</structureType>
        <enabled>true</enabled>
    </dictionary>
    <dictionary>
        <id>dict-type-user-type</id>
        <code>USER_TYPE</code>
        <name>用户类型</name>
        <description>用户类型。</description>
        <enumClass>com.corwin.framework.constant.UserType</enumClass>
        <valueType>STRING</valueType>
        <structureType>FLAT</structureType>
        <enabled>true</enabled>
    </dictionary>
    <dictionary>
        <id>dict-type-web-user-status</id>
        <code>WEB_USER_STATUS</code>
        <name>用户状态</name>
        <description>用户状态。</description>
        <enumClass>com.corwin.system.webuser.domain.model.WebUserStatus</enumClass>
        <valueType>STRING</valueType>
        <structureType>FLAT</structureType>
        <enabled>true</enabled>
    </dictionary>
    <dictionary>
        <id>dict-type-database-type</id>
        <code>DATABASE_TYPE</code>
        <name>数据库类型</name>
        <description>数据库类型。</description>
        <enumClass>com.corwin.datasource.domain.model.DatabaseType</enumClass>
        <valueType>STRING</valueType>
        <structureType>FLAT</structureType>
        <enabled>true</enabled>
    </dictionary>
    <dictionary>
        <id>dict-type-data-source-status</id>
        <code>DATA_SOURCE_STATUS</code>
        <name>数据源状态</name>
        <description>数据源状态。</description>
        <enumClass>com.corwin.datasource.domain.model.DatabaseSourceStatus</enumClass>
        <valueType>STRING</valueType>
        <structureType>FLAT</structureType>
        <enabled>true</enabled>
    </dictionary>
    <dictionary>
        <id>dict-type-data-source-connect-mode</id>
        <code>DATA_SOURCE_CONNECT_MODE</code>
        <name>数据源连接模式</name>
        <description>数据源连接模式。</description>
        <enumClass>com.corwin.datasource.domain.model.ConnectMode</enumClass>
        <valueType>STRING</valueType>
        <structureType>FLAT</structureType>
        <enabled>true</enabled>
    </dictionary>
    <dictionary>
        <id>dict-type-login-event</id>
        <code>LOGIN_EVENT</code>
        <name>登录事件</name>
        <description>登录事件类型。</description>
        <enumClass>com.corwin.system.auth.domain.model.LoginEventType</enumClass>
        <valueType>STRING</valueType>
        <structureType>FLAT</structureType>
        <enabled>true</enabled>
    </dictionary>
    <dictionary>
        <id>dict-type-session-status</id>
        <code>SESSION_STATUS</code>
        <name>登录会话状态</name>
        <description>登录会话状态。</description>
        <enumClass>com.corwin.system.auth.domain.model.SessionStatus</enumClass>
        <valueType>STRING</valueType>
        <structureType>FLAT</structureType>
        <enabled>true</enabled>
    </dictionary>
    <dictionary>
        <id>dict-type-refresh-token-status</id>
        <code>REFRESH_TOKEN_STATUS</code>
        <name>刷新令牌状态</name>
        <description>刷新令牌状态。</description>
        <enumClass>com.corwin.system.auth.domain.model.RefreshTokenStatus</enumClass>
        <valueType>STRING</valueType>
        <structureType>FLAT</structureType>
        <enabled>true</enabled>
    </dictionary>
    <dictionary>
        <id>dict-type-audit-level</id>
        <code>AUDIT_LEVEL</code>
        <name>审计等级</name>
        <description>审计日志等级。</description>
        <enumClass>com.corwin.system.audit.domain.model.AuditLevel</enumClass>
        <valueType>STRING</valueType>
        <structureType>FLAT</structureType>
        <enabled>true</enabled>
    </dictionary>
    <dictionary>
        <id>dict-type-audit-resource</id>
        <code>AUDIT_RESOURCE</code>
        <name>审计资源</name>
        <description>审计日志资源类型。</description>
        <enumClass>com.corwin.system.audit.domain.model.AuditResource</enumClass>
        <valueType>STRING</valueType>
        <structureType>FLAT</structureType>
        <enabled>true</enabled>
    </dictionary>
    <dictionary>
        <id>dict-type-audit-action</id>
        <code>AUDIT_ACTION</code>
        <name>审计动作</name>
        <description>审计日志动作类型。</description>
        <enumClass>com.corwin.system.audit.domain.model.AuditAction</enumClass>
        <valueType>STRING</valueType>
        <structureType>FLAT</structureType>
        <enabled>true</enabled>
    </dictionary>
    <dictionary>
        <id>dict-type-reminder-source-type</id>
        <code>REMINDER_SOURCE_TYPE</code>
        <name>提醒来源类型</name>
        <description>提醒来源类型。</description>
        <enumClass>com.corwin.reminder.domain.model.SourceType</enumClass>
        <valueType>STRING</valueType>
        <structureType>FLAT</structureType>
        <enabled>true</enabled>
    </dictionary>
    <dictionary>
        <id>dict-type-reminder-outbox-status</id>
        <code>REMINDER_OUTBOX_STATUS</code>
        <name>提醒发送状态</name>
        <description>提醒发送状态。</description>
        <enumClass>com.corwin.reminder.domain.model.ReminderOutboxStatus</enumClass>
        <valueType>STRING</valueType>
        <structureType>FLAT</structureType>
        <enabled>true</enabled>
    </dictionary>
    <dictionary>
        <id>dict-type-schedule-event-status</id>
        <code>SCHEDULE_EVENT_STATUS</code>
        <name>日程状态</name>
        <description>日程状态。</description>
        <enumClass>com.corwin.reminder.domain.model.ScheduleEventStatus</enumClass>
        <valueType>STRING</valueType>
        <structureType>FLAT</structureType>
        <enabled>true</enabled>
    </dictionary>
    <dictionary>
        <id>dict-type-recurrence-rule-frequency</id>
        <code>RECURRENCE_RULE_FREQUENCY</code>
        <name>重复频率</name>
        <description>重复规则频率。</description>
        <enumClass>com.corwin.reminder.domain.model.RecurrenceRuleFrequency</enumClass>
        <valueType>STRING</valueType>
        <structureType>FLAT</structureType>
        <enabled>true</enabled>
    </dictionary>
    <dictionary>
        <id>dict-type-todo-attachment-stage</id>
        <code>TODO_ATTACHMENT_STAGE</code>
        <name>待办附件阶段</name>
        <description>待办附件阶段。</description>
        <enumClass>com.corwin.reminder.domain.model.TodoAttachmentStage</enumClass>
        <valueType>STRING</valueType>
        <structureType>FLAT</structureType>
        <enabled>true</enabled>
    </dictionary>
    <dictionary>
        <id>dict-type-api-status</id>
        <code>API_STATUS</code>
        <name>接口状态</name>
        <description>接口状态。</description>
        <enumClass>com.corwin.system.resource.domain.model.ApiStatus</enumClass>
        <valueType>STRING</valueType>